{
  "$schema": "https://github.com/Emily2040/seedance-2.0/schemas/prompt-spec-v2.schema.json",
  "schema_version": 2,
  "status": "compile_required",
  "prompt_spec_id": "migration_watch.clip_01.spec_01",
  "project_id": "migration_watch",
  "clip_id": "clip_01",
  "state_revision": 1,
  "canon_revision": 1,
  "semantic_state_sha256": "c86ab543a6bb3c2e43215fe8b551edfa8d62a4f8a006d27a91315cfdaedb94f8",
  "sequence_relation": "standalone",
  "opening_source": "planned_start",
  "parent_clip_id": null,
  "planned_start_snapshot_sha256": "a272efb0f5251fd67eac48b203ab24730dc40d0e024b1255159dd65e6a71432e",
  "planned_end_snapshot_sha256": "8253ffcae86b5ed50e80cb02003b94540968294c3ab8561b32d058b11b8f3d33",
  "observed_source_snapshot_sha256": null,
  "accepted_source_media_sha256": null,
  "source_take_id": null,
  "source_take_review_sha256": null,
  "source_accepted_deviation_ids": [],
  "endpoint_states_sha256": "02978310f626b5790796342bca13e51fafe41cd90046ca78e39c997d3af7d928",
  "carry_forward_motion_bindings": [],
  "completed_beat_ids": [],
  "reserved_future_beat_ids": [],
  "continuity_rule_ids": [],
  "motion_snapshot_sha256": "27ecb32b9aa57b080b90dfdc127e2c6ebb47fc8d47410bd6964ccd19e8566fd6",
  "reference_binding_ids": ["product_ref"],
  "planning_status": "planning_required",
  "reference_manifest_sha256": null,
  "scene_ir_sha256": null,
  "planning_report_sha256": null
}
